{
  "$schema": "https://json-schema.org/draft/2020-12/schema",
  "title": "avd-assess-method/v1: the rules avd-assess's method runs (method.json)",
  "description": "Contract C20. The machine-readable part of avd-assess's gap files: where each fact comes from (collection), declarative checks of published claims against registered facts (assessment), what each C14 decision needs (readiness) and how outcomes roll up (scoring). No code: a check is a JSON pointer, a filter and an expectation. avd-current-state runs a byte-identical copy pinned by commit; the brain checks it with Test-AssessMethod.",
  "type": "object",
  "required": ["schema", "version", "factRegister", "collection", "checks", "readiness", "scoring"],
  "additionalProperties": false,
  "$defs": {
    "factId": { "type": "string", "pattern": "^(c11|c12|intake|liquidware)\\.[A-Za-z0-9.]{2,80}$" },
    "claimRef": { "type": "string", "pattern": "^ref:[a-z0-9][a-z0-9-]{1,63}#[A-Za-z0-9][A-Za-z0-9.:-]{0,63}$" },
    "gapRef": { "type": "string", "pattern": "^gap:[a-z0-9][a-z0-9-]{1,63}$" },
    "decisionId": { "type": "string", "pattern": "^[a-z][A-Za-z.]{1,40}$" },
    "pointer": { "type": "string", "pattern": "^(/([A-Za-z][A-Za-z0-9]{0,40}|\\*))+$", "description": "JSON pointer into a C11 snapshot or a C19 intake; * is every array item" },
    "property": { "type": "string", "pattern": "^[A-Za-z][A-Za-z0-9]{0,40}(/[A-Za-z][A-Za-z0-9]{0,40}){0,3}$", "description": "Relative to each subject" },
    "scalar": { "type": ["string", "number", "boolean", "null"] },
    "test": {
      "type": "object",
      "minProperties": 1,
      "maxProperties": 1,
      "additionalProperties": false,
      "properties": {
        "eq": { "$ref": "#/$defs/scalar" },
        "ne": { "$ref": "#/$defs/scalar" },
        "min": { "type": "number" },
        "max": { "type": "number" },
        "in": { "type": "array", "minItems": 1, "items": { "$ref": "#/$defs/scalar" } }
      }
    },
    "line": { "type": "string", "minLength": 3, "maxLength": 160, "pattern": "^[^\\n\\r]+$" }
  },
  "properties": {
    "$schema": { "type": "string" },
    "schema": { "const": "avd-assess-method/v1" },
    "version": { "type": "integer", "minimum": 1, "description": "Bumped on any change to a check, a readiness rule or the scoring; C21 reports pin it" },
    "factRegister": { "type": "integer", "minimum": 1, "description": "The C15 register version the method's fact IDs come from" },
    "collection": {
      "type": "array",
      "description": "Where each fact comes from, a gap file in avd-assess. Each row cites the reference that documents the property; only the join is ours.",
      "items": {
        "type": "object",
        "required": ["fact", "from", "claims"],
        "additionalProperties": false,
        "properties": {
          "fact": { "$ref": "#/$defs/factId" },
          "from": { "enum": ["resource-graph", "arm-rest", "wara", "insights", "intake"] },
          "table": { "type": "string", "pattern": "^[A-Za-z][A-Za-z0-9_.-]{1,80}$", "description": "Resource Graph table, Insights table or ARM resource type" },
          "property": { "type": "string", "pattern": "^[A-Za-z][A-Za-z0-9_./\\[\\]-]{0,120}$" },
          "claims": { "type": "array", "items": { "anyOf": [{ "$ref": "#/$defs/claimRef" }, { "$ref": "#/$defs/gapRef" }] } }
        }
      }
    },
    "checks": {
      "type": "array",
      "minItems": 1,
      "items": {
        "type": "object",
        "required": ["id", "title", "pillar", "severity", "claims", "facts", "rule", "informs"],
        "additionalProperties": false,
        "properties": {
          "id": { "type": "string", "pattern": "^asm-[a-z0-9-]{3,60}$" },
          "title": { "$ref": "#/$defs/line" },
          "pillar": { "enum": ["reliability", "security", "cost", "operations", "performance"] },
          "severity": { "enum": ["high", "medium", "low"] },
          "claims": { "type": "array", "minItems": 1, "items": { "$ref": "#/$defs/claimRef" } },
          "facts": { "type": "array", "minItems": 1, "uniqueItems": true, "items": { "$ref": "#/$defs/factId" } },
          "rule": {
            "type": "object",
            "required": ["each", "expect"],
            "additionalProperties": false,
            "description": "For each subject at 'each' that matches 'where', every 'expect' test must hold. A missing property makes that subject unknown, never a failure.",
            "properties": {
              "each": { "$ref": "#/$defs/pointer" },
              "where": { "type": "object", "propertyNames": { "$ref": "#/$defs/property" }, "additionalProperties": { "$ref": "#/$defs/test" } },
              "expect": { "type": "object", "minProperties": 1, "propertyNames": { "$ref": "#/$defs/property" }, "additionalProperties": { "$ref": "#/$defs/test" } },
              "onFail": { "enum": ["gap", "warn"], "default": "gap", "description": "warn: a trade-off to review, not a defect" }
            }
          },
          "informs": { "type": "array", "uniqueItems": true, "items": { "$ref": "#/$defs/decisionId" } }
        }
      }
    },
    "readiness": {
      "type": "array",
      "description": "One row per C14 decision (gap:decision-readiness).",
      "items": {
        "type": "object",
        "required": ["decision", "readiness", "facts", "claims"],
        "additionalProperties": false,
        "properties": {
          "decision": { "$ref": "#/$defs/decisionId" },
          "readiness": { "enum": ["decidable", "decidable-with-intake", "needs-measurement"] },
          "facts": { "type": "array", "uniqueItems": true, "items": { "$ref": "#/$defs/factId" }, "description": "Facts that decide it; for needs-measurement, the forensic facts a measurement would supply" },
          "claims": { "type": "array", "items": { "anyOf": [{ "$ref": "#/$defs/claimRef" }, { "$ref": "#/$defs/gapRef" }] } }
        }
      }
    },
    "scoring": {
      "type": "object",
      "description": "gap:scoring, a research hypothesis: a pillar's score is the passing severity weight over the assessed weight, warn counting warnFactor; coverage (checks not unknown over all checks) is always shown beside it; no overall number.",
      "required": ["model", "weights", "warnFactor", "overall"],
      "additionalProperties": false,
      "properties": {
        "model": { "const": "severity-weighted/v1" },
        "weights": {
          "type": "object",
          "required": ["high", "medium", "low"],
          "additionalProperties": false,
          "properties": { "high": { "type": "number", "exclusiveMinimum": 0 }, "medium": { "type": "number", "exclusiveMinimum": 0 }, "low": { "type": "number", "exclusiveMinimum": 0 } }
        },
        "warnFactor": { "type": "number", "minimum": 0, "maximum": 1 },
        "overall": { "const": false, "description": "Version 1 has no single overall number (the owner's call to change)" }
      }
    }
  }
}
